{
  "schema_version": "0.5.0",
  "backtrace_id": "qbacktrace-partial-001",
  "created_at": "2026-10-18T01:10:00Z",

  "incident_id": "incident-partial-001",

  "start_ref": {
    "type": "incident",
    "id": "incident-partial-001"
  },

  "status": "partial",

  "steps": [
    {
      "step_id": "bt-partial-001",
      "sequence": 0,
      "object_type": "incident",
      "object_id": "incident-partial-001",
      "relation_to_previous": "start",
      "confidence": "confirmed",
      "evidence_refs": [
        "trace-incident-partial-001"
      ]
    },
    {
      "step_id": "bt-partial-002",
      "sequence": 1,
      "object_type": "action",
      "object_id": "action-partial-001",
      "relation_to_previous": "resulted_from",
      "confidence": "confirmed",
      "evidence_refs": [
        "receipt-action-partial-001"
      ]
    },
    {
      "step_id": "bt-partial-003",
      "sequence": 2,
      "object_type": "question",
      "object_id": "q-partial-001",
      "relation_to_previous": "triggered_by",
      "confidence": "uncertain",
      "candidate_flags": [
        "trace_gap"
      ],
      "notes": "Earlier question lineage could not be reconstructed from the available evidence."
    }
  ],

  "trace_parent": "trace-qbacktrace-partial-001"
}
