{
  "schema_version": "0.5.0",
  "backtrace_id": "qbacktrace-minimal-001",
  "created_at": "2026-10-18T00:45:00Z",

  "incident_id": "incident-001",

  "start_ref": {
    "type": "incident",
    "id": "incident-001"
  },

  "status": "open",

  "steps": [
    {
      "step_id": "bt-step-001",
      "sequence": 0,
      "object_type": "incident",
      "object_id": "incident-001",
      "relation_to_previous": "start"
    }
  ]
}
